{
    "fullName": {
        "en": "John Doe"
    },
    "achievementDescription":{
        "en": "For the completion of the short course on Developmental Psychology I., at the Department of Psychology, Faculty of Social Sciences, Lalaland University, on the 5th May 2025."
    },
    "gradeAchieved":{
        "en": "Pass"
    },
    "verificationMethod":{
        "en": "Supervised with ID Verification"
    },
    "type":{
        "en": "written examination"
    },
    "mode":{
        "en": "Online"
    },
    "title":{
        "en": "Written Exam"
    },
    "ectsPoints":"5",
    "achievementTitle":{
        "en": "Title of the Qualification"
    },
    "hoursOfLearning":"PT60H",
    "nationalId":"12345",
    "nationalIdCountry":{
        "en": "Slovenia"
    },
    "awardingStatement":{
        "en": "is awarded to"
    }
}